{
  "commands": [
    "backend.version",
    "backend.health",
    "backend.capabilities",
    "runner.run",
    "runner.plan",
    "runner.stream",
    "responses.create",
    "ask",
    "askInThread",
    "askWithFiles",
    "askAndDownload",
    "runMessages",
    "openThread",
    "readLatest",
    "copyLatest",
    "downloadLatest",
    "runPlan",
    "doctor",
    "createReport",
    "reports.create",
    "reports.redact",
    "reports.summarize",
    "commands",
    "describe",
    "help",
    "session.bootstrap",
    "experience.detect",
    "experience.open",
    "configuration.inspect",
    "configuration.apply",
    "work.start",
    "work.status",
    "work.wait",
    "work.steer",
    "work.readLatest",
    "threads.new",
    "threads.search",
    "threads.open",
    "messages.compose",
    "messages.submit",
    "messages.ask",
    "messages.wait",
    "messages.readLatest",
    "messages.status",
    "messages.waitAndRead",
    "artifacts.listLatest",
    "artifacts.wait",
    "artifacts.downloadLatest",
    "files.preflight",
    "files.attach",
    "files.downloadLatest",
    "projects.sources.list",
    "projects.sources.planAdd",
    "projects.sources.add",
    "modes.set",
    "modes.get",
    "tools.select",
    "response.copy"
  ],
  "execution": {
    "browserCommands": "serialized_per_session",
    "correlation": "requestId",
    "subagentRuntime": "bootstrap_per_agent",
    "tabAffinity": "enforced_after_bootstrap"
  },
  "packageVersion": "0.5.1-alpha.1",
  "protocolVersion": "chatgpt.browser_control.backend_request.v1",
  "sessionId": "<backend-session-id>",
  "streaming": {
    "modes": [
      "ndjson"
    ],
    "tokenDeltas": false
  },
  "transports": [
    "stdio"
  ]
}
